{
  "$schema": "./registry.schema.json",
  "schemaVersion": 1,
  "reviewedAt": "2026-08-30",
  "statusDefinitions": {
    "implemented": "Present, production-reachable, and backed by named verification evidence.",
    "partial": "Present but has a documented boundary, structural risk, or incomplete verification.",
    "planned": "Desired in the target architecture but not implemented.",
    "accepted_exception": "A deliberate divergence from the target pattern with a recorded reason and guard.",
    "deprecated": "Present only for migration or compatibility and should lose callers.",
    "unknown": "Not yet reviewed with enough evidence to classify."
  },
  "components": [
    {
      "id": "core",
      "name": "Excise.Core project",
      "kind": "project",
      "layer": "foundation",
      "paths": ["Excise.Core"],
      "projectFile": "Excise.Core/Excise.Core.csproj",
      "projectDependencies": [],
      "allowedProjectDependencies": [],
      "currentStatus": "implemented",
      "targetStatus": "implemented",
      "summary": "Pure-.NET PDF object model, parsing, content semantics, editing, writing, security, and validation.",
      "targetState": "Remain UI- and platform-independent; expose explicit, bounded domain APIs consumed by every delivery surface.",
      "primaryWorkflows": ["open-view", "redact-save", "edit-save", "make-searchable", "verify-signature"],
      "dependsOn": [],
      "verification": ["Excise.Core.Tests", "scripts/check-reachability.sh --quiet", "scripts/check-unwired-api.sh --assembly Excise.Core --quiet"],
      "knownGaps": ["The public library surface is intentionally broad and still needs periodic production-reachability triage."],
      "issueIds": [921]
    },
    {
      "id": "core-primitives",
      "name": "PDF primitives and object graph",
      "kind": "subsystem",
      "layer": "foundation",
      "paths": ["Excise.Core/Primitives"],
      "currentStatus": "implemented",
      "targetStatus": "implemented",
      "summary": "Typed PDF objects, references, dictionaries, arrays, streams, strings, names, and numbers.",
      "targetState": "Keep primitives deterministic, allocation-conscious, and free of workflow or UI policy.",
      "primaryWorkflows": ["open-view", "redact-save", "edit-save", "make-searchable", "verify-signature"],
      "dependsOn": [],
      "verification": ["Excise.Core.Tests/Primitives"],
      "knownGaps": []
    },
    {
      "id": "core-parsing",
      "name": "Parser, xref, filters, and hostile-input boundary",
      "kind": "subsystem",
      "layer": "foundation",
      "paths": ["Excise.Core/Parsing", "Excise.Core/Filters"],
      "currentStatus": "implemented",
      "targetStatus": "implemented",
      "summary": "Loads untrusted PDF bytes, recovers supported malformed structures, resolves xrefs, and decodes streams.",
      "targetState": "Every attacker-controlled size, nesting level, loop, and resource allocation is bounded and fails with a typed diagnostic.",
      "primaryWorkflows": ["open-view", "redact-save", "edit-save", "make-searchable", "verify-signature"],
      "dependsOn": ["core-primitives"],
      "verification": ["Excise.Core.Tests/Parsing", "Excise.Core.Tests/Filters", "Excise.Core.Tests/Parsing/StructureAwareFuzzTests.cs"],
      "knownGaps": ["Long-run resource budgets and reproducible minimized fuzz-corpus handling remain active work."],
      "issueIds": [1232]
    },
    {
      "id": "core-document",
      "name": "Document model and mutation boundary",
      "kind": "subsystem",
      "layer": "engine",
      "paths": ["Excise.Core/Document", "Excise.Core/Editing", "Excise.Core/Operations"],
      "currentStatus": "partial",
      "targetStatus": "implemented",
      "summary": "Owns PdfDocument/PdfPage state, page trees, annotations, forms, editing, merge/split, and high-level mutations.",
      "targetState": "Separate document lifetime, focused mutation services, and conservation policies so PdfDocument is not the accumulation point for unrelated workflows.",
      "primaryWorkflows": ["open-view", "redact-save", "edit-save", "make-searchable", "verify-signature"],
      "dependsOn": ["core-primitives", "core-parsing"],
      "verification": ["Excise.Core.Tests/Document", "Excise.Core.Tests/Editing", "Excise.Core.Tests/Operations"],
      "knownGaps": ["PdfDocument.cs remains a multi-thousand-line coordination surface and needs responsibility mapping before any split."],
      "issueIds": [1261]
    },
    {
      "id": "core-content",
      "name": "Content-stream walker and sinks",
      "kind": "subsystem",
      "layer": "engine",
      "paths": ["Excise.Core/Content"],
      "currentStatus": "implemented",
      "targetStatus": "implemented",
      "summary": "One content-stream state machine tokenizes operators and emits shared glyph/state semantics to specialized sinks.",
      "targetState": "Keep one authoritative walk; new consumers add sinks or operator consumers and never duplicate PDF text/graphics state.",
      "primaryWorkflows": ["open-view", "redact-save", "edit-save"],
      "dependsOn": ["core-primitives", "core-parsing", "core-fonts"],
      "verification": ["Excise.Core.Tests/Content", "Excise.Core.Tests/Text/TextMatrixLineSteppingTests.cs"],
      "knownGaps": ["The renderer necessarily re-executes graphics/text state and is an explicitly tracked exception rather than a model for new consumers."],
      "issueIds": [980, 986, 992]
    },
    {
      "id": "core-fonts",
      "name": "Font decoding, metrics, and subsetting",
      "kind": "subsystem",
      "layer": "engine",
      "paths": ["Excise.Core/Fonts", "Excise.Core/Resources/CMaps"],
      "currentStatus": "partial",
      "targetStatus": "implemented",
      "summary": "Resolves embedded and standard fonts, CMaps, encodings, widths, Unicode mappings, and authored-font subsets.",
      "targetState": "One font interpretation contract supplies extraction, geometry, redaction, authoring, and rendering without duplicated width/encoding tables.",
      "primaryWorkflows": ["open-view", "redact-save", "edit-save", "make-searchable"],
      "dependsOn": ["core-primitives", "core-parsing"],
      "verification": ["Excise.Core.Tests/Fonts", "Excise.Core.Tests/Text"],
      "knownGaps": ["Full PDF font-model completeness remains broader than the currently supported corpus."],
      "issueIds": [1242, 1265]
    },
    {
      "id": "core-text",
      "name": "Text extraction, ordering, search geometry, and selection",
      "kind": "subsystem",
      "layer": "engine",
      "paths": ["Excise.Core/Text"],
      "currentStatus": "implemented",
      "targetStatus": "implemented",
      "summary": "Turns walked glyphs into letters, words, reading order, search matches, and selection/copy semantics.",
      "targetState": "Share glyph decoding and geometry with redaction while keeping reading-order policy explicit and independently measured.",
      "primaryWorkflows": ["open-view", "redact-save"],
      "dependsOn": ["core-content", "core-fonts"],
      "verification": ["Excise.Core.Tests/Text", "scripts/check-extraction-parity.sh"],
      "knownGaps": ["Extraction coverage remains a measured bound on text redaction completeness, not a proof of completeness."],
      "issueIds": []
    },
    {
      "id": "core-redaction",
      "name": "Glyph-, image-, and carrier-level redaction",
      "kind": "subsystem",
      "layer": "engine",
      "paths": ["Excise.Core/Text/Segmentation", "Excise.Core/Operations/PdfDocumentSanitizer.cs"],
      "currentStatus": "partial",
      "targetStatus": "implemented",
      "summary": "Finds target glyphs/images, reconstructs content, scrubs non-page carriers, and reports removal outcomes.",
      "targetState": "Every shipping entry point uses the same fail-secure pipeline, and every security claim is judged by a non-Excise oracle or an explicit reason.",
      "primaryWorkflows": ["redact-save"],
      "dependsOn": ["core-content", "core-document", "core-text", "core-writing"],
      "verification": ["scripts/verify-true-redaction.sh", "scripts/check-redaction-oracles.sh", "Excise.Core.Tests/Text/Segmentation", "Excise.Rendering.Tests/Differential/RedactionReferenceVerificationTests.cs"],
      "knownGaps": ["Three current redaction test methods are not independently corroborated and must be reviewed."],
      "issueIds": [1029, 1077]
    },
    {
      "id": "core-writing",
      "name": "Fresh-write serialization and encryption preservation",
      "kind": "subsystem",
      "layer": "engine",
      "paths": ["Excise.Core/Writing"],
      "currentStatus": "implemented",
      "targetStatus": "implemented",
      "summary": "Serializes objects, content, xrefs, object streams, encryption dictionaries, and fresh rewritten output.",
      "targetState": "All mutations conserve unrelated document properties unless a named policy deliberately removes them; outputs remain interoperable with independent readers.",
      "primaryWorkflows": ["redact-save", "edit-save", "make-searchable"],
      "dependsOn": ["core-primitives", "core-document", "core-security"],
      "verification": ["Excise.Core.Tests/Writing", "Excise.Core.Tests/Conformance"],
      "knownGaps": []
    },
    {
      "id": "core-security",
      "name": "Encryption, permissions, signatures, and document validation",
      "kind": "subsystem",
      "layer": "engine",
      "paths": ["Excise.Core/Security", "Excise.Core/Validation"],
      "currentStatus": "partial",
      "targetStatus": "implemented",
      "summary": "Reads/writes encryption, interprets permissions, parses signature structures, and validates PDF/A and PDF/UA properties.",
      "targetState": "Security policy is explicit at action boundaries, cryptographic interop is independently checked, and validation claims name their external oracle where one exists.",
      "primaryWorkflows": ["open-view", "redact-save", "edit-save", "verify-signature"],